{
  "schema_version": "1.0",
  "dataset_id": "aihd-retrieval-golden-v1",
  "frozen_at": "2026-08-18T03:48:00+08:00",
  "cases": [
    {
      "case_id": "RET-D-001",
      "split": "DESIGN",
      "query": "写进 AGENTS.md 的规则，怎样确认在 Codex 中生效？",
      "expected_status": "CANDIDATE",
      "expected_candidates": ["FIX-CODEX-AGENTS"],
      "risk_class": "LOW",
      "precondition": "ELIGIBLE",
      "provenance": { "kind": "observed_public_safe", "source_ref": "knowledge/public/cards/AIHD-PC-000001.json#question", "privacy": "public_safe" },
      "rationale": "现有公开卡的精确问题，应召回对应候选但不能直接 ALLOW。",
      "tags": ["exact", "existing-public-card", "positive"]
    },
    {
      "case_id": "RET-D-002",
      "split": "DESIGN",
      "query": "写进 AGENTS.md 为什么没生效？",
      "expected_status": "CANDIDATE",
      "expected_candidates": ["FIX-CODEX-AGENTS"],
      "risk_class": "LOW",
      "precondition": "ELIGIBLE",
      "provenance": { "kind": "observed_public_safe", "source_ref": "knowledge/public/cards/AIHD-PC-000001.json#aliases[0]", "privacy": "public_safe" },
      "rationale": "现有公开 alias，应命中 AGENTS 生效验证候选。",
      "tags": ["alias", "existing-public-card", "positive"]
    },
    {
      "case_id": "RET-D-003",
      "split": "DESIGN",
      "query": "AGENTS.md 规则怎么确认生效",
      "expected_status": "CANDIDATE",
      "expected_candidates": ["FIX-CODEX-AGENTS"],
      "risk_class": "LOW",
      "precondition": "ELIGIBLE",
      "provenance": { "kind": "observed_public_safe", "source_ref": "tests/public-card-live-pack.test.mjs public-safe paraphrase", "privacy": "public_safe" },
      "rationale": "公开回归中出现过的自然缩写问法。",
      "tags": ["natural-paraphrase", "existing-public-card", "positive"]
    },
    {
      "case_id": "RET-D-004",
      "split": "DESIGN",
      "query": "Codex 没按项目说明做，我怎么验证它到底读没读 AGENTS.md？",
      "expected_status": "CANDIDATE",
      "expected_candidates": ["FIX-CODEX-AGENTS"],
      "risk_class": "LOW",
      "precondition": "ELIGIBLE",
      "provenance": { "kind": "synthetic_fixture", "source_ref": "Phase 1 public-safe paraphrase design", "privacy": "public_safe" },
      "rationale": "同义自然问法聚焦是否读取及行为探针，而非文件作用域。",
      "tags": ["natural-paraphrase", "existing-public-card", "positive"]
    },
    {
      "case_id": "RET-D-005",
      "split": "DESIGN",
      "query": "规则应该写在全局还是项目 AGENTS.md，怎样判断指令作用域与覆盖？",
      "expected_status": "CANDIDATE",
      "expected_candidates": ["FIX-CODEX-INSTRUCTION-SCOPE"],
      "risk_class": "LOW",
      "precondition": "ELIGIBLE",
      "provenance": { "kind": "synthetic_fixture", "source_ref": "fixture-index.v1.json FIX-CODEX-INSTRUCTION-SCOPE", "privacy": "public_safe" },
      "rationale": "精确对应指令作用域 fixture。",
      "tags": ["exact", "positive", "synthetic-card"]
    },
    {
      "case_id": "RET-D-006",
      "split": "DESIGN",
      "query": "AGENTS.md 应该放在哪一层目录？",
      "expected_status": "CANDIDATE",
      "expected_candidates": ["FIX-CODEX-INSTRUCTION-SCOPE"],
      "risk_class": "LOW",
      "precondition": "ELIGIBLE",
      "provenance": { "kind": "synthetic_fixture", "source_ref": "fixture-index.v1.json scope alias", "privacy": "public_safe" },
      "rationale": "询问文件放置层级，核心是作用域而非生效探针。",
      "tags": ["alias", "positive", "synthetic-card"]
    },
    {
      "case_id": "RET-D-007",
      "split": "DESIGN",
      "query": "项目规则和子目录规则冲突时到底采用哪一份？",
      "expected_status": "CANDIDATE",
      "expected_candidates": ["FIX-CODEX-INSTRUCTION-SCOPE"],
      "risk_class": "LOW",
      "precondition": "ELIGIBLE",
      "provenance": { "kind": "synthetic_fixture", "source_ref": "Phase 1 scope paraphrase design", "privacy": "public_safe" },
      "rationale": "明确询问层级覆盖关系。",
      "tags": ["natural-paraphrase", "positive", "synthetic-card"]
    },
    {
      "case_id": "RET-D-008",
      "split": "DESIGN",
      "query": "我从仓库根目录启动 Codex，子目录里的指令会不会覆盖上层？",
      "expected_status": "CANDIDATE",
      "expected_candidates": ["FIX-CODEX-INSTRUCTION-SCOPE"],
      "risk_class": "LOW",
      "precondition": "ELIGIBLE",
      "provenance": { "kind": "synthetic_fixture", "source_ref": "Phase 1 scope paraphrase design", "privacy": "public_safe" },
      "rationale": "包含启动目录语境，但目标仍是指令链覆盖。",
      "tags": ["context-rich", "positive", "synthetic-card"]
    },
    {
      "case_id": "RET-D-009",
      "split": "DESIGN",
      "query": "Codex 不能读取文件或执行命令时，怎样排查沙箱与审批权限？",
      "expected_status": "CANDIDATE",
      "expected_candidates": ["FIX-CODEX-SANDBOX"],
      "risk_class": "MEDIUM",
      "precondition": "ELIGIBLE",
      "provenance": { "kind": "synthetic_fixture", "source_ref": "fixture-index.v1.json FIX-CODEX-SANDBOX", "privacy": "public_safe" },
      "rationale": "精确对应权限与沙箱 fixture。",
      "tags": ["exact", "positive", "synthetic-card"]
    },
    {
      "case_id": "RET-D-010",
      "split": "DESIGN",
      "query": "命令被 sandbox 拒绝该怎么查？",
      "expected_status": "CANDIDATE",
      "expected_candidates": ["FIX-CODEX-SANDBOX"],
      "risk_class": "MEDIUM",
      "precondition": "ELIGIBLE",
      "provenance": { "kind": "synthetic_fixture", "source_ref": "fixture-index.v1.json sandbox alias", "privacy": "public_safe" },
      "rationale": "直接描述 sandbox 拒绝。",
      "tags": ["alias", "positive", "synthetic-card"]
    },
    {
      "case_id": "RET-D-011",
      "split": "DESIGN",
      "query": "Codex 报没有权限打开文件，是审批设置还是文件系统隔离？",
      "expected_status": "CANDIDATE",
      "expected_candidates": ["FIX-CODEX-SANDBOX"],
      "risk_class": "MEDIUM",
      "precondition": "ELIGIBLE",
      "provenance": { "kind": "synthetic_fixture", "source_ref": "Phase 1 sandbox paraphrase design", "privacy": "public_safe" },
      "rationale": "权限、审批、文件隔离共同指向沙箱诊断。",
      "tags": ["natural-paraphrase", "positive", "synthetic-card"]
    },
    {
      "case_id": "RET-D-012",
      "split": "DESIGN",
      "query": "这不是模型不听指令，终端命令是被系统权限挡住了，怎么定位？",
      "expected_status": "CANDIDATE",
      "expected_candidates": ["FIX-CODEX-SANDBOX"],
      "risk_class": "MEDIUM",
      "precondition": "ELIGIBLE",
      "provenance": { "kind": "synthetic_fixture", "source_ref": "Phase 1 sandbox paraphrase design", "privacy": "public_safe" },
      "rationale": "显式排除软指令问题，目标是技术权限边界。",
      "tags": ["contrastive", "positive", "synthetic-card"]
    },
    {
      "case_id": "RET-D-013",
      "split": "DESIGN",
      "query": "怎样连接并验证 Codex 的 MCP 服务？",
      "expected_status": "CANDIDATE",
      "expected_candidates": ["FIX-CODEX-MCP"],
      "risk_class": "MEDIUM",
      "precondition": "ELIGIBLE",
      "provenance": { "kind": "synthetic_fixture", "source_ref": "fixture-index.v1.json FIX-CODEX-MCP", "privacy": "public_safe" },
      "rationale": "精确对应 MCP fixture。",
      "tags": ["exact", "positive", "synthetic-card"]
    },
    {
      "case_id": "RET-D-014",
      "split": "DESIGN",
      "query": "MCP 配好了为什么工具列表里没有？",
      "expected_status": "CANDIDATE",
      "expected_candidates": ["FIX-CODEX-MCP"],
      "risk_class": "MEDIUM",
      "precondition": "ELIGIBLE",
      "provenance": { "kind": "synthetic_fixture", "source_ref": "fixture-index.v1.json MCP alias", "privacy": "public_safe" },
      "rationale": "描述 MCP 配置后未投影到工具列表。",
      "tags": ["alias", "positive", "synthetic-card"]
    },
    {
      "case_id": "RET-D-015",
      "split": "DESIGN",
      "query": "MCP doctor 显示正常，但这个 Codex 会话还是看不到工具怎么办？",
      "expected_status": "CANDIDATE",
      "expected_candidates": ["FIX-CODEX-MCP"],
      "risk_class": "MEDIUM",
      "precondition": "ELIGIBLE",
      "provenance": { "kind": "synthetic_fixture", "source_ref": "Phase 1 MCP session projection paraphrase", "privacy": "public_safe" },
      "rationale": "健康检查与当前会话投影不等价，仍是 MCP 验证问题。",
      "tags": ["context-rich", "positive", "synthetic-card"]
    },
    {
      "case_id": "RET-D-016",
      "split": "DESIGN",
      "query": "添加 server 以后怎么证明 Codex 真的建立了 MCP 连接？",
      "expected_status": "CANDIDATE",
      "expected_candidates": ["FIX-CODEX-MCP"],
      "risk_class": "MEDIUM",
      "precondition": "ELIGIBLE",
      "provenance": { "kind": "synthetic_fixture", "source_ref": "Phase 1 MCP paraphrase design", "privacy": "public_safe" },
      "rationale": "聚焦 MCP 连接的实证验证。",
      "tags": ["natural-paraphrase", "positive", "synthetic-card"]
    },
    {
      "case_id": "RET-D-017",
      "split": "DESIGN",
      "query": "OpenClaw 为什么记不住上一轮，怎样区分项目记忆与当前会话？",
      "expected_status": "CANDIDATE",
      "expected_candidates": ["FIX-OPENCLAW-MEMORY"],
      "risk_class": "MEDIUM",
      "precondition": "ELIGIBLE",
      "provenance": { "kind": "synthetic_fixture", "source_ref": "fixture-index.v1.json FIX-OPENCLAW-MEMORY", "privacy": "public_safe" },
      "rationale": "精确对应 OpenClaw 记忆 fixture。",
      "tags": ["exact", "positive", "synthetic-card"]
    },
    {
      "case_id": "RET-D-018",
      "split": "DESIGN",
      "query": "小龙虾为什么忘了我上次说的事？",
      "expected_status": "CANDIDATE",
      "expected_candidates": ["FIX-OPENCLAW-MEMORY"],
      "risk_class": "MEDIUM",
      "precondition": "ELIGIBLE",
      "provenance": { "kind": "synthetic_fixture", "source_ref": "fixture-index.v1.json memory alias", "privacy": "public_safe" },
      "rationale": "小龙虾是 OpenClaw 的公开昵称语境，询问跨轮记忆。",
      "tags": ["alias", "positive", "synthetic-card"]
    },
    {
      "case_id": "RET-D-019",
      "split": "DESIGN",
      "query": "换了一个 session 后上下文没了，但项目 memory 应该还在吗？",
      "expected_status": "CANDIDATE",
      "expected_candidates": ["FIX-OPENCLAW-MEMORY"],
      "risk_class": "MEDIUM",
      "precondition": "ELIGIBLE",
      "provenance": { "kind": "synthetic_fixture", "source_ref": "Phase 1 memory paraphrase design", "privacy": "public_safe" },
      "rationale": "明确区分 session 上下文与项目长期记忆。",
      "tags": ["context-rich", "positive", "synthetic-card"]
    },
    {
      "case_id": "RET-D-020",
      "split": "DESIGN",
      "query": "怎样做写入再读回，确认 OpenClaw 的长期记忆真的保存了？",
      "expected_status": "CANDIDATE",
      "expected_candidates": ["FIX-OPENCLAW-MEMORY"],